{
  "finding_id": "finding-4adf608fccef",
  "lifecycle_state": "observed",
  "statement": "Node kimeisele/steward-federation is OK — descriptor present, role=agent_federation_descriptor, tier=none, charter=false, last commit 2026-10-18T04:59:18Z",
  "evidence_refs": ["ev-2ce557013023", "ev-66c081a9b3bd", "ev-992a22329578", "ev-57fe1ecead92", "ev-ea17824f33e2"],
  "domain": "node_census",
  "severity": "info",
  "created_at": "2026-10-18T05:02:02Z"
}
