{
  "finding_id": "finding-3dfe1b531ce8",
  "lifecycle_state": "observed",
  "statement": "Node kimeisele/steward is OK — descriptor present, role=operator, tier=none, charter=true, last commit 2026-10-31T06:02:30Z",
  "evidence_refs": ["ev-f74a55d781ba", "ev-5f27d2d870c0", "ev-18d9591e3bc5", "ev-05031704ff2b", "ev-fa99a8128c55"],
  "domain": "node_census",
  "severity": "info",
  "created_at": "2026-10-31T06:11:26Z"
}
