{
  "finding_id": "finding-a3de0420a572",
  "lifecycle_state": "observed",
  "statement": "Node kimeisele/steward is OK — descriptor present, role=operator, tier=none, charter=true, last commit 2026-10-09T06:32:12Z",
  "evidence_refs": ["ev-f74a55d781ba", "ev-5f27d2d870c0", "ev-18d9591e3bc5", "ev-05031704ff2b", "ev-a1b2dc0c26a4"],
  "domain": "node_census",
  "severity": "info",
  "created_at": "2026-10-09T06:34:55Z"
}
