{
  "finding_id": "finding-e6b68d4eebe4",
  "lifecycle_state": "observed",
  "statement": "Node kimeisele/steward-federation is OK — descriptor present, role=agent_federation_descriptor, tier=none, charter=false, last commit 2026-10-03T05:31:41Z",
  "evidence_refs": ["ev-2ce557013023", "ev-66c081a9b3bd", "ev-992a22329578", "ev-57fe1ecead92", "ev-30be986bb32e"],
  "domain": "node_census",
  "severity": "info",
  "created_at": "2026-10-03T05:39:23Z"
}
