{
  "finding_id": "finding-574df1ff86ef",
  "lifecycle_state": "observed",
  "statement": "Node kimeisele/steward is OK — descriptor present, role=operator, tier=none, charter=true, last commit 2026-11-01T06:34:25Z",
  "evidence_refs": ["ev-f74a55d781ba", "ev-5f27d2d870c0", "ev-18d9591e3bc5", "ev-05031704ff2b", "ev-29869fd52916"],
  "domain": "node_census",
  "severity": "info",
  "created_at": "2026-11-01T06:43:24Z"
}
