{
  "finding_id": "finding-30341da5dce0",
  "lifecycle_state": "observed",
  "statement": "Node kimeisele/steward is OK — descriptor present, role=operator, tier=none, charter=true, last commit 2026-09-14T05:17:09Z",
  "evidence_refs": ["ev-f74a55d781ba", "ev-5f27d2d870c0", "ev-18d9591e3bc5", "ev-05031704ff2b", "ev-752497aa5b4c"],
  "domain": "node_census",
  "severity": "info",
  "created_at": "2026-09-14T05:21:36Z"
}
