{
  "finding_id": "finding-d97a45c2fdc9",
  "lifecycle_state": "observed",
  "statement": "Node kimeisele/steward is OK — descriptor present, role=operator, tier=none, charter=true, last commit 2026-08-30T05:32:20Z",
  "evidence_refs": ["ev-f74a55d781ba", "ev-5f27d2d870c0", "ev-18d9591e3bc5", "ev-05031704ff2b", "ev-7c008216a785"],
  "domain": "node_census",
  "severity": "info",
  "created_at": "2026-08-30T05:43:21Z"
}
