{
  "finding_id": "finding-86658e6ea3a0",
  "lifecycle_state": "observed",
  "statement": "Node kimeisele/steward is OK — descriptor present, role=operator, tier=none, charter=true, last commit 2026-07-24T15:17:18Z",
  "evidence_refs": ["ev-f452c6038fbc", "ev-e8d735daf64f", "ev-c00892ff6b95", "ev-f452c6038fbc", "ev-c134a1d1325e"],
  "domain": "node_census",
  "severity": "info",
  "created_at": "2026-07-24T15:24:49Z"
}
