{
  "finding_id": "finding-e9b8ddfb5ab2",
  "lifecycle_state": "observed",
  "statement": "Node kimeisele/steward-federation is OK — descriptor present, role=agent_federation_descriptor, tier=none, charter=false, last commit 2026-08-23T02:01:45Z",
  "evidence_refs": ["ev-2ce557013023", "ev-66c081a9b3bd", "ev-992a22329578", "ev-57fe1ecead92", "ev-42aa3caede46"],
  "domain": "node_census",
  "severity": "info",
  "created_at": "2026-08-23T02:10:46Z"
}
