{
  "finding_id": "finding-32adef2e1ffb",
  "lifecycle_state": "observed",
  "statement": "Node kimeisele/steward-federation is OK — descriptor present, role=agent_federation_descriptor, tier=none, charter=false, last commit 2026-09-08T05:04:13Z",
  "evidence_refs": ["ev-2ce557013023", "ev-66c081a9b3bd", "ev-992a22329578", "ev-57fe1ecead92", "ev-d4eb0215fe66"],
  "domain": "node_census",
  "severity": "info",
  "created_at": "2026-09-08T05:06:03Z"
}
