{
  "finding_id": "finding-c1bd02c38960",
  "lifecycle_state": "observed",
  "statement": "Node kimeisele/steward-federation is OK — descriptor present, role=agent_federation_descriptor, tier=none, charter=false, last commit 2026-10-27T05:16:56Z",
  "evidence_refs": ["ev-2ce557013023", "ev-66c081a9b3bd", "ev-992a22329578", "ev-57fe1ecead92", "ev-e5ab2d470984"],
  "domain": "node_census",
  "severity": "info",
  "created_at": "2026-10-27T05:29:12Z"
}
