{
  "finding_id": "finding-98897e3977ce",
  "lifecycle_state": "observed",
  "statement": "Node kimeisele/steward-federation is OK — descriptor present, role=agent_federation_descriptor, tier=none, charter=true, last commit 2026-07-26T16:53:07Z",
  "evidence_refs": ["ev-2aaa8618bf4e", "ev-bd46657b8b92", "ev-11f76fd07a7d", "ev-2aaa8618bf4e", "ev-0f2d5a3f89c2"],
  "domain": "node_census",
  "severity": "info",
  "created_at": "2026-07-26T16:57:52Z"
}
