{
  "finding_id": "finding-9c2a582efcb5",
  "lifecycle_state": "observed",
  "statement": "Node kimeisele/steward is OK — descriptor present, role=operator, tier=none, charter=true, last commit 2026-08-21T02:04:56Z",
  "evidence_refs": ["ev-f74a55d781ba", "ev-5f27d2d870c0", "ev-18d9591e3bc5", "ev-05031704ff2b", "ev-8d5a8a9406fb"],
  "domain": "node_census",
  "severity": "info",
  "created_at": "2026-08-21T02:09:40Z"
}
