{
  "finding_id": "finding-217053a51d1b",
  "lifecycle_state": "observed",
  "statement": "Node kimeisele/steward is OK — descriptor present, role=operator, tier=none, charter=true, last commit 2026-08-01T03:46:52Z",
  "evidence_refs": ["ev-f452c6038fbc", "ev-e8d735daf64f", "ev-c00892ff6b95", "ev-f452c6038fbc", "ev-5512f43279ad"],
  "domain": "node_census",
  "severity": "info",
  "created_at": "2026-08-01T04:02:43Z"
}
