{
  "finding_id": "finding-9a90bca32667",
  "lifecycle_state": "observed",
  "statement": "Node kimeisele/steward-federation is OK — descriptor present, role=agent_federation_descriptor, tier=none, charter=false, last commit 2026-10-11T06:18:35Z",
  "evidence_refs": ["ev-2ce557013023", "ev-66c081a9b3bd", "ev-992a22329578", "ev-57fe1ecead92", "ev-460cb8e8b8f9"],
  "domain": "node_census",
  "severity": "info",
  "created_at": "2026-10-11T06:18:35Z"
}
