{
  "finding_id": "finding-0f3a77b24c2c",
  "lifecycle_state": "observed",
  "statement": "Node kimeisele/steward is OK — descriptor present, role=operator, tier=none, charter=true, last commit 2026-10-15T04:47:30Z",
  "evidence_refs": ["ev-f74a55d781ba", "ev-5f27d2d870c0", "ev-18d9591e3bc5", "ev-05031704ff2b", "ev-eb66618f0a27"],
  "domain": "node_census",
  "severity": "info",
  "created_at": "2026-10-15T05:04:28Z"
}
