{
  "finding_id": "finding-889396303018",
  "lifecycle_state": "observed",
  "statement": "Node kimeisele/steward is OK — descriptor present, role=operator, tier=none, charter=true, last commit 2026-07-26T16:53:28Z",
  "evidence_refs": ["ev-f452c6038fbc", "ev-e8d735daf64f", "ev-c00892ff6b95", "ev-f452c6038fbc", "ev-2c4123e6ddc6"],
  "domain": "node_census",
  "severity": "info",
  "created_at": "2026-07-26T16:57:54Z"
}
