{
  "finding_id": "finding-8018585f3098",
  "lifecycle_state": "observed",
  "statement": "Node kimeisele/agent-red-team is OK — descriptor present, role=agent_federation_descriptor, tier=node, charter=true, last commit 2026-07-21T04:46:34Z",
  "evidence_refs": ["ev-7b14d3eb365e", "ev-89266473e2f7", "ev-b820efc5bc0e", "ev-7b14d3eb365e", "ev-1d3eb4c681e1"],
  "domain": "node_census",
  "severity": "info",
  "created_at": "2026-07-23T17:15:52Z"
}
