{
  "finding_id": "finding-d0514d5de8a9",
  "lifecycle_state": "observed",
  "statement": "Node kimeisele/steward is OK — descriptor present, role=operator, tier=none, charter=true, last commit 2026-08-03T04:04:36Z",
  "evidence_refs": ["ev-f452c6038fbc", "ev-e8d735daf64f", "ev-c00892ff6b95", "ev-f452c6038fbc", "ev-7bec1ff50faa"],
  "domain": "node_census",
  "severity": "info",
  "created_at": "2026-08-03T04:09:23Z"
}
