{
  "finding_id": "finding-625e14a3818d",
  "lifecycle_state": "observed",
  "statement": "Node kimeisele/steward-federation is OK — descriptor present, role=agent_federation_descriptor, tier=none, charter=false, last commit 2026-09-29T06:01:52Z",
  "evidence_refs": ["ev-2ce557013023", "ev-66c081a9b3bd", "ev-992a22329578", "ev-57fe1ecead92", "ev-1c02da6d5cc7"],
  "domain": "node_census",
  "severity": "info",
  "created_at": "2026-09-29T06:04:29Z"
}
