{
  "finding_id": "finding-f5806985e4b8",
  "lifecycle_state": "observed",
  "statement": "Node kimeisele/steward-federation is OK — descriptor present, role=agent_federation_descriptor, tier=none, charter=false, last commit 2026-08-25T02:04:43Z",
  "evidence_refs": ["ev-2ce557013023", "ev-66c081a9b3bd", "ev-992a22329578", "ev-57fe1ecead92", "ev-e19012ae091f"],
  "domain": "node_census",
  "severity": "info",
  "created_at": "2026-08-25T02:04:48Z"
}
